{
  "threads": {
    "r": 8,
    "julia": 8
  },
  "timeout_secs": {
    "python": 60,
    "julia": 60
  },
  "python_timeout_estimators": [
    "linearmodels.AbsorbingLS",
    "statsmodels.OLS"
  ],
  "iterations": {
    "n_iters": 3,
    "burn_in": 1
  },
  "formulas": {
    "ols": {
      "2": {
        "python": "y ~ x1 | indiv_id + year",
        "r_fixest": "y ~ x1 | indiv_id + year",
        "r_lfe": "y ~ x1 | indiv_id + year",
        "julia": "y ~ x1 + fe(indiv_id) + fe(year)"
      },
      "3": {
        "python": "y ~ x1 | indiv_id + year + firm_id",
        "r_fixest": "y ~ x1 | indiv_id + year + firm_id",
        "r_lfe": "y ~ x1 | indiv_id + year + firm_id",
        "julia": "y ~ x1 + fe(indiv_id) + fe(year) + fe(firm_id)"
      }
    },
    "poisson": {
      "2": {
        "python": "negbin_y ~ x1 | indiv_id + year",
        "r_fixest": "negbin_y ~ x1 | indiv_id + year",
        "r_alpaca": "negbin_y ~ x1 | indiv_id + year",
        "julia": "negbin_y ~ x1 + fe(indiv_id) + fe(year)"
      },
      "3": {
        "python": "negbin_y ~ x1 | indiv_id + year + firm_id",
        "r_fixest": "negbin_y ~ x1 | indiv_id + year + firm_id",
        "r_alpaca": "negbin_y ~ x1 | indiv_id + year + firm_id",
        "julia": "negbin_y ~ x1 + fe(indiv_id) + fe(year) + fe(firm_id)"
      }
    },
    "logit": {
      "2": {
        "python": "binary_y ~ x1 | indiv_id + year",
        "r_fixest": "binary_y ~ x1 | indiv_id + year",
        "julia": "binary_y ~ x1 + fe(indiv_id) + fe(year)"
      },
      "3": {
        "python": "binary_y ~ x1 | indiv_id + year + firm_id",
        "r_fixest": "binary_y ~ x1 | indiv_id + year + firm_id",
        "julia": "binary_y ~ x1 + fe(indiv_id) + fe(year) + fe(firm_id)"
      }
    }
  },
  "datasets": [
    { "name": "simple_1k", "n": 1000, "type": "simple" },
    { "name": "difficult_1k", "n": 1000, "type": "difficult" },
    { "name": "simple_10k", "n": 10000, "type": "simple" },
    { "name": "difficult_10k", "n": 10000, "type": "difficult" },
    { "name": "simple_100k", "n": 100000, "type": "simple" },
    { "name": "difficult_100k", "n": 100000, "type": "difficult" },
    { "name": "simple_500k", "n": 500000, "type": "simple" },
    { "name": "difficult_500k", "n": 500000, "type": "difficult" },
    { "name": "simple_1m", "n": 1000000, "type": "simple" },
    { "name": "difficult_1m", "n": 1000000, "type": "difficult" }
  ],
  "datasets_by_type": {
    "ols": [
      "simple_1k",
      "difficult_1k",
      "simple_10k",
      "difficult_10k",
      "simple_100k",
      "difficult_100k",
      "simple_500k",
      "difficult_500k",
      "simple_1m",
      "difficult_1m"
    ],
    "poisson": [
      "simple_1k",
      "difficult_1k",
      "simple_10k",
      "difficult_10k",
      "simple_100k",
      "difficult_100k",
      "simple_500k",
      "difficult_500k"
    ],
    "logit": [
      "simple_1k",
      "difficult_1k",
      "simple_10k",
      "difficult_10k",
      "simple_100k",
      "difficult_100k",
      "simple_500k",
      "difficult_500k"
    ]
  },
  "real_data": [
    {
      "name": "nycflights13",
      "parquet": "data/real/nycflights13.parquet",
      "n_iters": 5,
      "n_fe": 3,
      "formulas": {
        "ols": {
          "r": "arr_delay ~ distance | carrier + origin + dest",
          "python": "arr_delay ~ distance | carrier + origin + dest",
          "julia": "arr_delay ~ distance + fe(carrier) + fe(origin) + fe(dest)"
        }
      }
    },
    {
      "name": "tradepolicy (OLS)",
      "parquet": "data/real/tradepolicy.parquet",
      "n_iters": 5,
      "n_fe": 3,
      "formulas": {
        "ols": {
          "r": "trade ~ rta + rta_lag4 + rta_lag8 + rta_lag12 + intl_border_1986 + intl_border_1990 + intl_border_1994 + intl_border_1998 + intl_border_2002 | exp_year + imp_year + pair_id_2",
          "python": "trade ~ rta + rta_lag4 + rta_lag8 + rta_lag12 + intl_border_1986 + intl_border_1990 + intl_border_1994 + intl_border_1998 + intl_border_2002 | exp_year + imp_year + pair_id_2",
          "julia": "trade ~ rta + rta_lag4 + rta_lag8 + rta_lag12 + intl_border_1986 + intl_border_1990 + intl_border_1994 + intl_border_1998 + intl_border_2002 + fe(exp_year) + fe(imp_year) + fe(pair_id_2)"
        },
        "poisson": {
          "r": "trade ~ rta + rta_lag4 + rta_lag8 + rta_lag12 + intl_border_1986 + intl_border_1990 + intl_border_1994 + intl_border_1998 + intl_border_2002 | exp_year + imp_year + pair_id_2",
          "python": "trade ~ rta + rta_lag4 + rta_lag8 + rta_lag12 + intl_border_1986 + intl_border_1990 + intl_border_1994 + intl_border_1998 + intl_border_2002 | exp_year + imp_year + pair_id_2",
          "julia": "trade ~ rta + rta_lag4 + rta_lag8 + rta_lag12 + intl_border_1986 + intl_border_1990 + intl_border_1994 + intl_border_1998 + intl_border_2002 + fe(exp_year) + fe(imp_year) + fe(pair_id_2)"
        }
      }
    },
    {
      "name": "nyc taxi",
      "parquet": "data/real/nyc_taxi.parquet",
      "n_iters": 5,
      "n_fe": 3,
      "formulas": {
        "ols": {
          "r": "tip_amount ~ trip_distance + passenger_count | dofw + vendor_id + payment_type",
          "python": "tip_amount ~ trip_distance + passenger_count | dofw + vendor_id + payment_type",
          "julia": "tip_amount ~ trip_distance + passenger_count + fe(dofw) + fe(vendor_id) + fe(payment_type)"
        }
      }
    },
    {
      "name": "Medicare Provider",
      "parquet": "data/real/medicare.parquet",
      "n_iters": 3,
      "n_fe": 3,
      "formulas": {
        "ols": {
          "r": "average_Medicare_payment_amt ~ line_srvc_cnt + bene_unique_cnt | nppes_provider_state + provider_type + hcpcs_code",
          "julia": "average_Medicare_payment_amt ~ line_srvc_cnt + bene_unique_cnt + fe(nppes_provider_state) + fe(provider_type) + fe(hcpcs_code)"
        }
      }
    }
  ]
}
